{
  "schema": "architecture-rot-registry/v1",
  "registryId": "harness-anything-product-architecture",
  "generatedAt": "2026-07-10T10:12:30Z",
  "sourceHead": "da5c205837740cfa3f9078e0a851605073a08af4",
  "records": [
    {
      "id": "ROT-001",
      "category": "manual-mirror",
      "title": "CLI command descriptors own parse and run",
      "mechanism": {
        "mustBeTrue": "Every command descriptor directly owns executable parse and run functions; dispatch is derived from commandSpecs rather than parserId/runnerId string registries.",
        "scope": [
          "packages/cli/src/cli/command-spec/**",
          "packages/cli/src/cli/parser-registry.ts",
          "packages/cli/src/cli/runner-registry.ts"
        ]
      },
      "detection": {
        "detector": "ROT-001",
        "command": "node --input-type=module -e 'import { commandSpecs } from \"./packages/cli/src/cli/command-spec/index.ts\"; const missing=commandSpecs.filter((spec)=>typeof spec.parse!==\"function\"||typeof spec.run!==\"function\").map((spec)=>spec.kind); console.log(JSON.stringify({total:commandSpecs.length,executableDescriptors:commandSpecs.length-missing.length,missingCount:missing.length,sample:missing.slice(0,5)})); process.exit(missing.length===0?0:1);'",
        "cwd": ".",
        "successExitCodes": [
          0
        ]
      },
      "firstSeen": [
        {
          "kind": "report-card",
          "report": "architecture-review-A-fable-4way-20260710.html",
          "card": "A#1 / #c1",
          "evidence": [
            "packages/cli/src/cli/command-spec/command-spec-core.ts:86",
            "packages/cli/src/cli/command-spec/types.ts:3-52",
            "packages/cli/src/cli/parser-registry.ts:36-185",
            "packages/cli/src/cli/runner-registry.ts:120-142"
          ]
        }
      ],
      "status": "open",
      "introducedCommit": null,
      "fixedCommit": null,
      "fixPullRequest": null,
      "lastRun": {
        "executedAt": "2026-07-10T10:12:30Z",
        "head": "da5c205837740cfa3f9078e0a851605073a08af4",
        "executionOutcome": "completed",
        "exitCode": 1,
        "stdout": "{\"total\":100,\"executableDescriptors\":0,\"missingCount\":100,\"sample\":[\"help\",\"version\",\"entity-list\",\"capabilities\",\"init\"]}\n",
        "stderr": "",
        "mechanismVerdict": "fail",
        "interpretation": "All 100 descriptors still expose string parser/runner identities without executable parse/run ownership."
      }
    },
    {
      "id": "ROT-002",
      "category": "shallow-slice",
      "title": "Command-local option help",
      "mechanism": {
        "mustBeTrue": "Every command spec owns non-empty option descriptions, and reused flag spellings may carry different descriptions in different command contexts.",
        "scope": [
          "packages/cli/src/cli/command-spec/**",
          "packages/cli/src/cli/command-registry.ts"
        ]
      },
      "detection": {
        "detector": "ROT-002",
        "command": "node --input-type=module -e 'import { commandSpecs } from \"./packages/cli/src/cli/command-spec/index.ts\"; const malformed=commandSpecs.filter((spec)=>!Array.isArray(spec.options)||spec.options.some((option)=>typeof option.flag!==\"string\"||typeof option.description!==\"string\"||option.description.trim()===\"\")); const descriptions=new Map(); for(const spec of commandSpecs) for(const option of spec.options){const values=descriptions.get(option.flag)??new Set(); values.add(option.description); descriptions.set(option.flag,values);} const contextual=[...descriptions].filter(([,values])=>values.size>1).map(([flag])=>flag); console.log(JSON.stringify({total:commandSpecs.length,malformedCount:malformed.length,contextualFlagCount:contextual.length,contextualSample:contextual.slice(0,5)})); process.exit(malformed.length===0&&contextual.length>0?0:1);'",
        "cwd": ".",
        "successExitCodes": [
          0
        ]
      },
      "firstSeen": [
        {
          "kind": "report-card",
          "report": "architecture-review-A-fable-4way-20260710.html",
          "card": "A#2 / #c2",
          "evidence": [
            "packages/cli/src/cli/command-option-descriptions.ts:43",
            "packages/cli/src/cli/command-option-descriptions.ts:116",
            "packages/cli/src/cli/command-registry.ts:146-149"
          ]
        }
      ],
      "status": "fixed",
      "introducedCommit": null,
      "fixedCommit": "3719fd8711241a9901b58b36de56f38560749a8c",
      "fixPullRequest": "PR#583",
      "lastRun": {
        "executedAt": "2026-07-10T10:12:30Z",
        "head": "da5c205837740cfa3f9078e0a851605073a08af4",
        "executionOutcome": "completed",
        "exitCode": 0,
        "stdout": "{\"total\":100,\"malformedCount\":0,\"contextualFlagCount\":6,\"contextualSample\":[\"--kind\",\"--risk-tier\",\"--urgency\",\"--source\",\"--type\"]}\n",
        "stderr": "",
        "mechanismVerdict": "pass",
        "interpretation": "All 100 specs own well-formed option descriptions and six reused flags now have contextual descriptions."
      }
    },
    {
      "id": "ROT-003",
      "category": "layer-misalignment",
      "title": "Executable transport-neutral API contract authority",
      "mechanism": {
        "mustBeTrue": "Every registered API schema is an executable codec and every route resolves its input through that codec; GUI, daemon, preload, and fixtures consume the same transport-neutral contract authority.",
        "scope": [
          "packages/gui/src/api/api-contract-registry.ts",
          "packages/gui/src/preload/allowlist.ts",
          "packages/daemon/src/protocol/json-rpc-server.ts",
          "packages/application/src/local-controller-payloads.ts"
        ]
      },
      "detection": {
        "detector": "ROT-003",
        "command": "node --input-type=module -e 'import { apiSchemaContracts,apiRouteContracts } from \"./packages/gui/src/api/api-contract-registry.ts\"; const executable=(schema)=>typeof schema.decode===\"function\"||typeof schema.codec?.decode===\"function\"; const missing=apiSchemaContracts.filter((schema)=>!executable(schema)).map((schema)=>schema.id); const unresolved=apiRouteContracts.filter((route)=>!apiSchemaContracts.some((schema)=>schema.id===route.inputSchemaId&&executable(schema))).map((route)=>route.id); console.log(JSON.stringify({schemas:apiSchemaContracts.length,executableSchemas:apiSchemaContracts.length-missing.length,routes:apiRouteContracts.length,routesWithExecutableInput:apiRouteContracts.length-unresolved.length,missingSchemaSample:missing.slice(0,5)})); process.exit(missing.length===0&&unresolved.length===0?0:1);'",
        "cwd": ".",
        "successExitCodes": [
          0
        ]
      },
      "firstSeen": [
        {
          "kind": "report-card",
          "report": "architecture-review-A-fable-4way-20260710.html",
          "card": "A#3 / #c3",
          "evidence": [
            "packages/gui/src/api/api-contract-registry.ts:9",
            "packages/daemon/src/protocol/json-rpc-server.ts:250",
            "packages/daemon/src/protocol/json-rpc-server.ts:571",
            "packages/gui/src/api/service-bridge.ts:52,148,188",
            "packages/application/src/local-controller-payloads.ts:17"
          ]
        },
        {
          "kind": "report-card",
          "report": "architecture-review-B-ci-arch-6day-20260710.html",
          "card": "B#02 / #candidate-contract",
          "evidence": [
            "packages/gui/src/api/api-contract-registry.ts:39-258",
            "packages/gui/src/preload/allowlist.ts:16-64",
            "packages/gui/src/api/service-bridge.ts:164-206",
            "packages/daemon/src/protocol/json-rpc-server.ts:110-182,250-293",
            "tools/check-api-contract-registry.mjs:96-109,172-246"
          ]
        }
      ],
      "status": "open",
      "introducedCommit": null,
      "fixedCommit": null,
      "fixPullRequest": null,
      "lastRun": {
        "executedAt": "2026-07-10T10:12:30Z",
        "head": "da5c205837740cfa3f9078e0a851605073a08af4",
        "executionOutcome": "completed",
        "exitCode": 1,
        "stdout": "{\"schemas\":22,\"executableSchemas\":0,\"routes\":17,\"routesWithExecutableInput\":0,\"missingSchemaSample\":[\"gui.empty/v1\",\"application.append-task-progress-payload/v1\",\"application.decision-detail-result/v1\",\"application.decision-id-payload/v1\",\"application.decision-list-result/v1\"]}\n",
        "stderr": "",
        "mechanismVerdict": "fail",
        "interpretation": "The registry contains 22 schema identifiers but no executable codecs; none of 17 routes has executable input decoding from the authority."
      }
    },
    {
      "id": "ROT-004",
      "category": "manual-mirror",
      "title": "Daemon command classes derive from command descriptors",
      "mechanism": {
        "mustBeTrue": "Every CLI command descriptor declares its daemon command class, and the daemon classifier is a derived projection equal to the descriptor set rather than three handwritten action Sets.",
        "scope": [
          "packages/cli/src/cli/command-spec/**",
          "packages/daemon/src/protocol/method-registry.ts",
          "packages/cli/src/daemon/command-service.ts"
        ]
      },
      "detection": {
        "detector": "ROT-004",